[
  {
    "id": "filesystem",
    "name": "Filesystem",
    "version": "0.6.2",
    "description": "Read, write, and search files within allow-listed directories. Official Anthropic MCP server.",
    "homepage": "https://github.com/modelcontextprotocol/servers/tree/main/src/filesystem",
    "license": "MIT",
    "tags": ["files", "io", "official"],
    "transport": "stdio",
    "runtime": "node",
    "entrypoint": {
      "command": "npx",
      "args": ["-y", "@modelcontextprotocol/server-filesystem", "${ONEMCP_FS_ROOT}"]
    },
    "envSchema": [
      {
        "name": "ONEMCP_FS_ROOT",
        "label": "Allowed root directory",
        "description": "Absolute path the MCP is permitted to read/write.",
        "required": true
      }
    ],
    "permissions": { "filesystem": { "read": ["${ONEMCP_FS_ROOT}"], "write": ["${ONEMCP_FS_ROOT}"] } }
  },
  {
    "id": "memory",
    "name": "Knowledge Graph Memory",
    "version": "0.6.0",
    "description": "Persistent knowledge graph the agent can query and update across turns.",
    "homepage": "https://github.com/modelcontextprotocol/servers/tree/main/src/memory",
    "license": "MIT",
    "tags": ["memory", "graph", "official"],
    "transport": "stdio",
    "runtime": "node",
    "entrypoint": { "command": "npx", "args": ["-y", "@modelcontextprotocol/server-memory"] }
  },
  {
    "id": "fetch",
    "name": "Fetch",
    "version": "0.6.0",
    "description": "Fetch URLs and convert HTML to markdown for agent consumption.",
    "homepage": "https://github.com/modelcontextprotocol/servers/tree/main/src/fetch",
    "license": "MIT",
    "tags": ["web", "http", "official"],
    "transport": "stdio",
    "runtime": "python",
    "entrypoint": { "command": "uvx", "args": ["mcp-server-fetch"] },
    "permissions": { "network": true }
  },
  {
    "id": "git",
    "name": "Git",
    "version": "0.6.0",
    "description": "Read-only git repository inspection: log, diff, blame, and status.",
    "homepage": "https://github.com/modelcontextprotocol/servers/tree/main/src/git",
    "license": "MIT",
    "tags": ["git", "vcs", "official"],
    "transport": "stdio",
    "runtime": "python",
    "entrypoint": { "command": "uvx", "args": ["mcp-server-git", "--repository", "${ONEMCP_GIT_REPO}"] },
    "envSchema": [
      { "name": "ONEMCP_GIT_REPO", "label": "Repository path", "required": true }
    ]
  },
  {
    "id": "github",
    "name": "GitHub",
    "version": "0.6.2",
    "description": "Search code, read issues/PRs, create issues and comments on GitHub via a personal access token.",
    "homepage": "https://github.com/github/github-mcp-server",
    "license": "MIT",
    "tags": ["github", "vcs", "code", "official"],
    "transport": "stdio",
    "runtime": "node",
    "entrypoint": { "command": "npx", "args": ["-y", "@modelcontextprotocol/server-github"] },
    "envSchema": [
      {
        "name": "GITHUB_PERSONAL_ACCESS_TOKEN",
        "label": "GitHub Personal Access Token",
        "description": "Fine-grained PAT with the scopes you want the agent to have.",
        "secret": true,
        "required": true
      }
    ],
    "permissions": { "network": true }
  },
  {
    "id": "postgres",
    "name": "PostgreSQL",
    "version": "1.0.0",
    "description": "Query and inspect PostgreSQL databases with safe read-only access. Run SQL, inspect schemas, list tables.",
    "homepage": "https://github.com/modelcontextprotocol/servers/tree/main/src/postgres",
    "license": "MIT",
    "tags": ["database", "postgres", "sql", "official"],
    "transport": "stdio",
    "runtime": "node",
    "entrypoint": { "command": "npx", "args": ["-y", "@modelcontextprotocol/server-postgres", "${POSTGRES_CONNECTION_STRING}"] },
    "envSchema": [
      {
        "name": "POSTGRES_CONNECTION_STRING",
        "label": "PostgreSQL connection string",
        "description": "e.g. postgresql://user:pass@host:5432/dbname",
        "secret": true,
        "required": true
      }
    ],
    "permissions": { "network": true }
  },
  {
    "id": "sqlite",
    "name": "SQLite",
    "version": "0.1.0",
    "description": "Query, inspect, and write to SQLite databases. Full read-write access to the configured DB file.",
    "homepage": "https://github.com/modelcontextprotocol/servers/tree/main/src/sqlite",
    "license": "MIT",
    "tags": ["database", "sqlite", "sql", "official"],
    "transport": "stdio",
    "runtime": "python",
    "entrypoint": { "command": "uvx", "args": ["mcp-server-sqlite", "--db-path", "${SQLITE_DB_PATH}"] },
    "envSchema": [
      {
        "name": "SQLITE_DB_PATH",
        "label": "SQLite database path",
        "required": true
      }
    ]
  },
  {
    "id": "brave-search",
    "name": "Brave Search",
    "version": "0.1.0",
    "description": "Web and local search using the Brave Search API. Supports web, image, news, and video search.",
    "homepage": "https://github.com/modelcontextprotocol/servers/tree/main/src/brave-search",
    "license": "MIT",
    "tags": ["search", "web", "official"],
    "transport": "stdio",
    "runtime": "node",
    "entrypoint": { "command": "npx", "args": ["-y", "@modelcontextprotocol/server-brave-search"] },
    "envSchema": [
      {
        "name": "BRAVE_API_KEY",
        "label": "Brave Search API key",
        "description": "Get a free API key at https://brave.com/search/api/",
        "secret": true,
        "required": true
      }
    ],
    "permissions": { "network": true }
  },
  {
    "id": "sequential-thinking",
    "name": "Sequential Thinking",
    "version": "0.6.2",
    "description": "Enables step-by-step reasoning via tool calls. Dramatically improves complex problem solving for any LLM.",
    "homepage": "https://github.com/modelcontextprotocol/servers/tree/main/src/sequentialthinking",
    "license": "MIT",
    "tags": ["reasoning", "thinking", "official"],
    "transport": "stdio",
    "runtime": "node",
    "entrypoint": { "command": "npx", "args": ["-y", "@modelcontextprotocol/server-sequential-thinking"] }
  },
  {
    "id": "playwright",
    "name": "Playwright Browser",
    "version": "0.0.29",
    "description": "Full browser automation: navigate, click, fill forms, take screenshots, and scrape any web page.",
    "homepage": "https://github.com/microsoft/playwright-mcp",
    "license": "Apache-2.0",
    "tags": ["browser", "automation", "playwright", "scraping"],
    "transport": "stdio",
    "runtime": "node",
    "entrypoint": { "command": "npx", "args": ["-y", "@playwright/mcp@latest"] },
    "permissions": { "network": true }
  },
  {
    "id": "slack",
    "name": "Slack",
    "version": "1.2.0",
    "description": "Read and send Slack messages, list channels, manage users, and create reactions.",
    "homepage": "https://github.com/modelcontextprotocol/servers/tree/main/src/slack",
    "license": "MIT",
    "tags": ["slack", "messaging", "communication", "official"],
    "transport": "stdio",
    "runtime": "node",
    "entrypoint": { "command": "npx", "args": ["-y", "@modelcontextprotocol/server-slack"] },
    "envSchema": [
      {
        "name": "SLACK_BOT_TOKEN",
        "label": "Slack Bot Token",
        "description": "Bot OAuth token starting with xoxb-",
        "secret": true,
        "required": true
      },
      {
        "name": "SLACK_TEAM_ID",
        "label": "Slack Team/Workspace ID",
        "required": true
      }
    ],
    "permissions": { "network": true }
  },
  {
    "id": "google-drive",
    "name": "Google Drive",
    "version": "0.6.2",
    "description": "Search, read, and create Google Drive documents, sheets, and files.",
    "homepage": "https://github.com/modelcontextprotocol/servers/tree/main/src/gdrive",
    "license": "MIT",
    "tags": ["google", "drive", "docs", "official"],
    "transport": "stdio",
    "runtime": "node",
    "entrypoint": {
      "command": "npx",
      "args": ["-y", "@modelcontextprotocol/server-gdrive"]
    },
    "envSchema": [
      {
        "name": "GDRIVE_CREDENTIALS_PATH",
        "label": "Google OAuth credentials.json path",
        "description": "Path to credentials.json from Google Cloud Console",
        "required": true
      }
    ],
    "permissions": { "network": true }
  },
  {
    "id": "linear",
    "name": "Linear",
    "version": "0.3.0",
    "description": "Create, update, and search Linear issues, cycles, and projects via the Linear API.",
    "homepage": "https://github.com/linear/linear",
    "license": "MIT",
    "tags": ["linear", "project-management", "issues"],
    "transport": "stdio",
    "runtime": "node",
    "entrypoint": { "command": "npx", "args": ["-y", "@linear/mcp-server"] },
    "envSchema": [
      {
        "name": "LINEAR_API_KEY",
        "label": "Linear API Key",
        "description": "Personal API key from Linear Settings → API",
        "secret": true,
        "required": true
      }
    ],
    "permissions": { "network": true }
  },
  {
    "id": "notion",
    "name": "Notion",
    "version": "1.0.0",
    "description": "Read and write Notion pages, databases, and blocks. Search across your entire workspace.",
    "homepage": "https://github.com/makenotion/notion-mcp-server",
    "license": "MIT",
    "tags": ["notion", "docs", "knowledge-base"],
    "transport": "stdio",
    "runtime": "node",
    "entrypoint": { "command": "npx", "args": ["-y", "@notionhq/notion-mcp-server"] },
    "envSchema": [
      {
        "name": "OPENAPI_MCP_HEADERS",
        "label": "Notion Authorization Header",
        "description": "JSON string: {\"Authorization\":\"Bearer ntn_xxx\",\"Notion-Version\":\"2022-06-28\"}",
        "secret": true,
        "required": true
      }
    ],
    "permissions": { "network": true }
  },
  {
    "id": "puppeteer",
    "name": "Puppeteer",
    "version": "0.6.2",
    "description": "Headless Chrome browser automation: screenshot, PDF, scraping, and DOM interaction.",
    "homepage": "https://github.com/modelcontextprotocol/servers/tree/main/src/puppeteer",